{
  "spec_version": "1.0",
  "website": {
    "name": "vibegen-official",
    "type": "company",
    "title": "VibeGen - AI驱动的开发工具",
    "description": "让每个人都能轻松创建应用的AI开发工具",
    "domain": "vibegen.com",
    "language": "zh-CN",
    "analytics": {
      "google_analytics": "G-XXXXXXXXXX",
      "plausible": false
    }
  },
  "business": {
    "name": "VibeGen",
    "tagline": "AI驱动的下一代开发工具",
    "industry": "technology",
    "founded": "2024",
    "description": "我们致力于让每个人都能轻松创建应用，无论技术背景如何。通过先进的AI技术，我们为用户提供智能的代码生成和项目构建服务。",
    "logo": {
      "light": "/images/logo-light.svg",
      "dark": "/images/logo-dark.svg"
    },
    "contact": {
      "email": "hello@vibegen.com",
      "phone": "+86 138-0013-8000",
      "address": "北京市朝阳区科技园区创新大厦8层",
      "social": {
        "github": "https://github.com/vibegen",
        "twitter": "https://twitter.com/vibegen",
        "linkedin": "https://linkedin.com/company/vibegen"
      }
    }
  },
  "sections": {
    "hero": {
      "enabled": true,
      "style": "gradient",
      "layout": "center",
      "background": {
        "type": "gradient",
        "colors": ["#6366f1", "#8b5cf6"]
      },
      "content": {
        "headline": "AI驱动的下一代开发工具",
        "subtitle": "让每个人都能轻松创建应用，无论技术背景如何。智能生成代码，快速构建项目，实现你的创意想法。",
        "cta_primary": {
          "text": "立即体验",
          "href": "#features",
          "style": "primary"
        },
        "cta_secondary": {
          "text": "了解更多",
          "href": "#about",
          "style": "outline"
        }
      },
      "media": {
        "type": "image",
        "src": "/images/hero-dashboard.png",
        "alt": "VibeGen产品界面展示"
      }
    },
    "features": {
      "enabled": true,
      "layout": "grid",
      "columns": 3,
      "title": "核心功能",
      "subtitle": "强大的功能，简单的使用体验",
      "items": [
        {
          "title": "AI智能生成",
          "description": "基于先进的AI技术，智能分析需求并生成高质量的代码和项目结构。",
          "icon": "🤖",
          "color": "#6366f1"
        },
        {
          "title": "零技术门槛",
          "description": "直观的界面设计和引导式操作流程，非程序员也能轻松上手创建应用。",
          "icon": "🎯",
          "color": "#8b5cf6"
        },
        {
          "title": "一键部署",
          "description": "集成主流部署平台，项目生成后即可快速部署上线，无需复杂配置。",
          "icon": "🚀",
          "color": "#06b6d4"
        },
        {
          "title": "多种模板",
          "description": "提供丰富的项目模板，覆盖官网、博客、电商等多种应用场景。",
          "icon": "🎨",
          "color": "#10b981"
        },
        {
          "title": "实时预览",
          "description": "支持实时预览和在线编辑，所见即所得的开发体验。",
          "icon": "👁️",
          "color": "#f59e0b"
        },
        {
          "title": "社区支持",
          "description": "活跃的开发者社区，丰富的教程资源和技术支持。",
          "icon": "🤝",
          "color": "#ef4444"
        }
      ]
    },
    "about": {
      "enabled": true,
      "title": "关于VibeGen",
      "content": "VibeGen致力于降低应用开发的门槛，让每个人都能实现自己的创意想法。我们相信技术应该为创意服务，而不是成为创意的障碍。通过AI的力量，我们正在重新定义软件开发的方式。",
      "image": "/images/about-team.jpg",
      "stats": [
        { "number": "10K+", "label": "活跃用户" },
        { "number": "50K+", "label": "生成项目" },
        { "number": "99.9%", "label": "系统可用性" },
        { "number": "4.9", "label": "用户评分" }
      ]
    },
    "pricing": {
      "enabled": true,
      "title": "定价方案",
      "subtitle": "灵活的定价方案，满足不同用户需求",
      "plans": [
        {
          "name": "免费版",
          "price": "¥0",
          "period": "永久免费",
          "description": "适合个人学习和小型项目",
          "features": [
            "每月3个项目",
            "基础模板库",
            "社区支持",
            "基础功能"
          ],
          "cta": "立即开始",
          "popular": false
        },
        {
          "name": "专业版",
          "price": "¥99",
          "period": "月",
          "description": "适合专业开发者和小团队",
          "features": [
            "无限项目数量",
            "所有高级模板",
            "优先技术支持",
            "高级功能解锁",
            "团队协作功能",
            "自定义域名"
          ],
          "cta": "选择专业版",
          "popular": true
        },
        {
          "name": "企业版",
          "price": "¥299",
          "period": "月",
          "description": "适合大型团队和企业客户",
          "features": [
            "专业版所有功能",
            "专属客户经理",
            "SLA保障",
            "私有化部署",
            "定制开发服务",
            "企业级安全"
          ],
          "cta": "联系销售",
          "popular": false
        }
      ]
    },
    "team": {
      "enabled": false
    },
    "testimonials": {
      "enabled": true,
      "title": "用户评价",
      "items": [
        {
          "content": "VibeGen让我在30分钟内就创建了一个专业的公司官网，完全超出了我的预期！",
          "author": "张明",
          "role": "创业者",
          "company": "创新科技",
          "avatar": "/images/testimonial-1.jpg"
        },
        {
          "content": "作为非技术背景的产品经理，我终于可以快速验证自己的产品想法了。",
          "author": "李华",
          "role": "产品经理",
          "company": "互联网公司",
          "avatar": "/images/testimonial-2.jpg"
        },
        {
          "content": "AI生成的代码质量很高，为我们节省了大量的开发时间和成本。",
          "author": "王强",
          "role": "技术总监",
          "company": "软件公司",
          "avatar": "/images/testimonial-3.jpg"
        }
      ]
    },
    "blog": {
      "enabled": false
    },
    "faq": {
      "enabled": true,
      "title": "常见问题",
      "items": [
        {
          "question": "VibeGen适合完全没有编程经验的用户吗？",
          "answer": "是的，VibeGen专为非程序员设计。我们提供直观的界面和引导式操作流程，您只需要描述自己的需求，AI会自动生成相应的代码和项目结构。"
        },
        {
          "question": "生成的代码质量如何？",
          "answer": "我们的AI模型经过大量优质代码训练，生成的代码遵循最佳实践，包含完整的错误处理、响应式设计和SEO优化等功能。"
        },
        {
          "question": "支持哪些类型的项目？",
          "answer": "目前支持公司官网、个人作品集、餐厅网站、博客等多种类型，我们会持续添加更多模板和功能。"
        },
        {
          "question": "生成的项目可以自由修改吗？",
          "answer": "当然可以！生成的代码完全属于您，您可以自由修改、部署和商用，没有任何限制。"
        },
        {
          "question": "如何获得技术支持？",
          "answer": "我们提供多种支持方式：社区论坛、在线文档、邮件支持，专业版和企业版用户还可享受优先技术支持。"
        }
      ]
    },
    "contact": {
      "enabled": true,
      "title": "联系我们",
      "subtitle": "有任何问题或建议？我们随时为您解答",
      "form": {
        "enabled": true,
        "fields": ["name", "email", "company", "message"]
      },
      "info": {
        "enabled": true,
        "address": "北京市朝阳区科技园区创新大厦8层",
        "phone": "+86 138-0013-8000",
        "email": "hello@vibegen.com"
      }
    }
  },
  "design": {
    "theme": "modern",
    "layout": "single-page",
    "colors": {
      "primary": "#6366f1",
      "secondary": "#8b5cf6",
      "accent": "#06b6d4",
      "background": "#ffffff",
      "text": "#1f2937"
    },
    "typography": {
      "font_family": "Inter",
      "headings": "Space Grotesk"
    },
    "spacing": "comfortable",
    "border_radius": "medium",
    "animations": true
  },
  "tech_stack": {
    "framework": "next.js",
    "ui_library": "tailwind-shadcn",
    "deployment": "vercel",
    "analytics": "google-analytics",
    "cms": "none"
  },
  "seo": {
    "meta_title": "VibeGen - AI驱动的开发工具",
    "meta_description": "让每个人都能轻松创建应用的AI开发工具。智能生成代码，快速构建项目，零技术门槛。",
    "keywords": ["AI", "开发工具", "网站生成", "应用开发", "代码生成", "低代码"],
    "open_graph": {
      "title": "VibeGen - AI驱动的开发工具",
      "description": "让每个人都能轻松创建应用",
      "image": "/images/og-image.jpg"
    },
    "structured_data": true
  },
  "performance": {
    "lazy_loading": true,
    "image_optimization": true,
    "code_splitting": true,
    "caching": "aggressive"
  },
  "security": {
    "https_only": true,
    "content_security_policy": true,
    "xss_protection": true
  }
}